{
  "$schema": "../_schema/group.schema.json",
  "id": "the_council",
  "title": "The Council",
  "description": [
    "One question, four answers. Four quests below wait on the same three trials, and",
    "each one uses a different rule for how many of them it needs: all started, any one",
    "completed, any two of the three, and the rule the chapter itself declares.",
    "",
    "Side by side they are the clearest way to see what a prerequisite mode is. The same",
    "three arrows arrive at each of them, and the four nodes disagree about what counts",
    "as enough -- which is how 'all_completed' stops being an incantation and becomes a",
    "choice.",
    "",
    "One node here leans on another group entirely, and it is deliberately the only edge",
    "in the whole collection that does: a dependency may name a quest in another",
    "chapter or another group, and that is the file to read if you were wondering how",
    "far a dependency can reach."
  ],
  "aliases": [
    "council"
  ],
  "chapters": [
    "the_round_table"
  ]
}
