{
  "$schema": "../_schema/group.schema.json",
  "id": "getting_started",
  "title": "Getting Started",
  "description": [
    "The first questline to read, and the shortest: one chain of five quests, which is",
    "what a quest is before any other chapter gets to show what a quest can do.",
    "",
    "The rest of the examples demonstrate one mechanism each, at a size that makes it",
    "visible. This one demonstrates the shape of the thing -- a node that fills in while",
    "you carry the right items, a node that waits for a button, and a node that is only",
    "about arriving."
  ],
  "chapters": [
    "first_steps"
  ]
}
